code,abstract
mccullough,"It has been demonstrated, by Robichek and Niebuhr [8], that tax-induced bias can substantially alter the shape of the yield curve if it is constructed from quotations on bonds selling below par. The apparent before tax yield curve can be upward sloping at the same time that the tax-adjusted yield curve is downward sloping. Thus, the inclusion of tax effects can actually reverse qualitative conclusions concerning the direc- tion in which investors expect interest rates to move under the expectations hypothesis. Furthermore, simple before tax term structure estimation does not satisfactorily explain the market prices of low coupon bonds selling at a discount, because of the long-term capital gains tax advantage on these securities. Treating these bonds as outliers is unsatisfactory, since they constitute the bulk of observations for some maturities. The present paper modifies our technique for regression fitting the term structure of interest rates, described in an earlier paper [4], to eliminate this tax-induced bias and reconcile observations on high and low coupon bonds."
waggoner,"Cubic splines have long been used to extract the discount, yield, and forward rate curves from coupon bond data. McCulloch used regression splines to estimate the discount function, and, more recently, Fisher, Nychka, and Zervos used smoothed splines, with the roughness penalty selected by generalized cross-validation, to estimate the forward rate curve. I propose using a smoothed spline but with a roughness penalty that can vary across maturities, to estimate the forward rate curve. This method is tested against the methods of McCulloch and Fisher, Nychka, and Zervos using monthly bond data from 1970 through 1995."
bjork_christiansen,"We consider as given an arbitrage‐free interest rate model M, and a parametrized family of forward rate curves G. We study the question as to when the given family G is consistent with the dynamics of the interest rate model M, in the sense that M actually will produce forward rate curves belonging to G. We allow the interest rate model to be driven by a multidimensional Wiener process, as well as by a marked point process, and we give necessary and sufficient conditions for consistency. As test cases, we study some popular models, obtaining both positive and negative results about consistency. We also introduce a natural exponential‐polynomial family of forward rate curves, and for this family we give necessary and sufficient conditions for the existence of consistent interest rate models with deterministic volatility functions. "
anderson_andreasen,"This paper considers extensions of the Libor market model (Brace et al (1997), Jamshidian (1997), Miltersen et al (1997)) to markets with volatility skews in observable option prices. We expand the family of forward rate processes to include diffusions with non-linear forward rate dependence and discuss efficient techniques for calibration to quoted prices of caps and swaptions. Special emphasis is put on generalized CEV processes for which closed-form expressions for cap and swaption prices are derived. We also discuss modifications of the CEV process which exhibit more appealing growth and boundary characteristics. The proposed models are investigated numerically through Crank-Nicholson finite difference schemes and Monte Carlo simulations."
andreasen,We combine classical ideas of separable volatility structures in the HJM framework with the latest techniques for calibration of stochastic volatility models and create a new class of efficient multi-factor term structure models with stochastic volatility. These models have the flexibility of as the Libor market models but the speed of the short rate models. 